Altmetric Attention Score,Title,Collection Title,Output Type,doi,News mentions,Blog mentions,Policy mentions,Patent mentions,Twitter mentions,Peer review mentions,Weibo mentions,Facebook mentions,Wikipedia mentions,GooglePlus mentions,LinkedIn mentions,Reddit mentions,Pinterest mentions,F1000 mentions,QandA mentions,Video mentions,Syllabi mentions,Number of Mendeley readers,Number of Dimensions citations,Details Page URL,Badge URL
157,Out on the fields: The first international study on homophobia in sport,Bridges,Dataset,10.26180/5e1e6059a7c0e,19,0,0,0,0,0,0,0,0,0,0,0,0,0,0,0,0,0,0,https://www.altmetric.com/details/93229186,https://api.altmetric.com/v1/donut/93229186_240.png
85,Modelling the impact of alcohol duty policies since 2012 in England & Scotland,The University of Sheffield,Dataset,10.15131/shef.data.9958763,6,1,0,0,70,0,0,1,0,0,0,0,0,0,0,0,0,2,0,https://www.altmetric.com/details/69158965,https://api.altmetric.com/v1/donut/69158965_240.png
63,Bannerdale Road School Streets Pilot-Evaluation Summary,The University of Sheffield,Dataset,10.15131/shef.data.13012406,6,0,0,0,20,0,0,0,0,0,0,0,0,0,0,0,0,0,0,https://www.altmetric.com/details/92044494,https://api.altmetric.com/v1/donut/92044494_240.png
45,CASES: General Report. The prevalence and characteristics of interpersonal violence against children (IVAC) inside and outside sport in six European countries,Edge Hill University,Dataset,10.25416/edgehill.17086616,3,0,0,0,24,0,0,0,0,0,0,0,0,0,0,0,0,0,0,https://www.altmetric.com/details/117847832,https://api.altmetric.com/v1/donut/117847832_240.png
17,"Using social media as a tool to facilitate consumer engagement in service design and quality improvement: A guide for hospitals, service providers and consumers",La Trobe,Dataset,10.26181/17169089,0,0,0,0,31,0,0,2,0,0,0,0,0,0,0,0,0,0,0,https://www.altmetric.com/details/123622663,https://api.altmetric.com/v1/donut/123622663_240.png
17,Unlocking real-world data to promote and protect health and prevent ill-health in the Yorkshire and Humber region,The University of Sheffield,Dataset,10.15131/shef.data.14723685,0,1,0,0,13,0,0,0,0,0,0,0,0,0,0,0,0,0,0,https://www.altmetric.com/details/107092974,https://api.altmetric.com/v1/donut/107092974_240.png
15,"Report on the extent, nature, and consequences of children and young peoples exposure to alcohol advertising and sponsorship",Bridges,Dataset,10.26180/5edde9f0a7a9d,0,0,0,0,27,0,0,0,0,0,0,0,0,0,0,0,0,0,0,https://www.altmetric.com/details/83555856,https://api.altmetric.com/v1/donut/83555856_240.png
14,"MCVD: Environmental Justice and Neighborhood Schools in Chicago, Illinois",Indigo,Dataset,10.25417/uic.14597814,1,0,0,0,4,0,0,0,0,0,0,0,0,0,0,0,0,0,0,https://www.altmetric.com/details/106238524,https://api.altmetric.com/v1/donut/106238524_240.png
13,What does kindness have to do with active school travel?,figshare,Dataset,10.17608/k6.auckland.12870686,0,0,0,0,21,0,0,0,0,0,0,0,0,0,0,0,0,0,0,https://www.altmetric.com/details/88947848,https://api.altmetric.com/v1/donut/88947848_240.png
11,Organisational actions to promote the health and wellbeing of healthcare staff during periods of increased demand: a systematic review,The University of Sheffield,Dataset,10.15131/shef.data.14268119,0,0,0,0,29,0,0,0,0,0,0,0,0,0,0,0,0,0,0,https://www.altmetric.com/details/102533918,https://api.altmetric.com/v1/donut/102533918_240.png
10,Promoting Australian general public awareness and action on antimicrobial resistance,Bridges,Dataset,10.26180/13101491,0,0,0,0,20,0,0,0,0,0,0,0,0,0,0,0,0,0,0,https://www.altmetric.com/details/99224620,https://api.altmetric.com/v1/donut/99224620_240.png
8,Increasing influenza vaccination of healthcare workers research briefing,The University of Sheffield,Dataset,10.15131/shef.data.13686208,0,0,0,0,15,0,0,0,0,0,0,0,0,0,0,0,0,0,0,https://www.altmetric.com/details/99323624,https://api.altmetric.com/v1/donut/99323624_240.png
8,GUIDANCE FOR THE PREVENTION OF ANTIMICROBIAL RESISTANCE WITH GENERAL PUBLICS,Bridges,Dataset,10.26180/19679769,0,0,0,0,12,0,0,0,0,0,0,0,0,0,0,0,0,0,0,https://www.altmetric.com/details/127667661,https://api.altmetric.com/v1/donut/127667661_240.png
7,The Australia-Indonesia Centre Research Report 2017,figshare,Dataset,10.4225/03/5af24b0a8ee51,0,0,0,0,8,0,0,0,0,0,0,0,0,0,0,0,0,0,0,https://www.altmetric.com/details/42294729,https://api.altmetric.com/v1/donut/42294729_240.png
6,Guiding Principles for Beneficial Electrification of Transportation: A Framework for Transportation Electrification in Illinois,Indigo,Dataset,10.25417/uic.13693678,0,0,0,0,8,0,0,0,0,0,0,0,0,0,0,0,0,0,0,https://www.altmetric.com/details/99294794,https://api.altmetric.com/v1/donut/99294794_240.png
5,What factors influence the mental health of university students in the UK: a rapid review of the evidence,The University of Sheffield,Dataset,10.15131/shef.data.14286167,0,0,0,0,10,0,0,0,0,0,0,0,0,0,0,0,0,0,0,https://www.altmetric.com/details/102704192,https://api.altmetric.com/v1/donut/102704192_240.png
5,Seruan untuk Kebijakan Pengaturan Tempat Penjualan Rokok di Indonesia (Hasil Penelitian dan Rekomendasi Kebijakan),figshare,Dataset,10.4225/03/5b163171d11f8,0,0,0,0,7,0,0,0,0,0,0,0,0,0,0,0,0,0,0,https://www.altmetric.com/details/43348928,https://api.altmetric.com/v1/donut/43348928_240.png
3,The Harm to Others from Drinking Phase 1 Protocol,figshare,Dataset,10.26181/5b84ebd47b944,0,0,1,0,0,0,0,0,0,0,0,0,0,0,0,0,0,0,0,https://www.altmetric.com/details/78809118,https://api.altmetric.com/v1/donut/78809118_240.png
3,Policy Analysis to Support Informal Workers in Greater Lawndale,Indigo,Dataset,10.25417/uic.17035850,0,0,0,0,5,0,0,0,0,0,0,0,0,0,0,0,0,0,0,https://www.altmetric.com/details/117356110,https://api.altmetric.com/v1/donut/117356110_240.png
2,Utbud av stod och behandling for spelproblem. Uppfoljning av fortydligat ansvar i lagstiftningen,figshare,Dataset,10.17045/sthlmuni.12497396,0,0,0,0,3,0,0,0,0,0,0,0,0,0,0,0,0,0,0,https://www.altmetric.com/details/84419887,https://api.altmetric.com/v1/donut/84419887_240.png
2,"Measuring, monitoring and translating urban liveability in Bangkok: Final Research Report",figshare,Dataset,10.25439/rmt.20113526,0,0,0,0,4,0,0,0,0,0,0,0,0,0,0,0,0,0,0,https://www.altmetric.com/details/131491622,https://api.altmetric.com/v1/donut/131491622_240.png
2,HIV and Aboriginal and Torres Strait Islander Performance Report: A context and background to Aboriginal and Torres Strait Islander performance work around HIV,figshare,Dataset,10.26188/623be75924913,0,0,0,0,2,0,0,0,0,0,0,0,0,0,0,0,0,0,0,https://www.altmetric.com/details/130713930,https://api.altmetric.com/v1/donut/130713930_240.png
2,(Summary report) Regional Initiatives: Building Health and Wellbeing in the First 1000 Days,figshare,Dataset,10.26180/5b6bd8d967e80,0,0,0,0,2,0,0,0,0,0,0,0,0,0,0,0,0,0,0,https://www.altmetric.com/details/46443671,https://api.altmetric.com/v1/donut/46443671_240.png
1,Addressing health inequity: Increasing participation and influence in local decision-making,The University of Sheffield,Dataset,10.15131/shef.data.13026827,0,0,0,0,2,0,0,0,0,0,0,0,0,0,0,0,0,0,0,https://www.altmetric.com/details/93509652,https://api.altmetric.com/v1/donut/93509652_240.png
1,Short Report-HIV and Aboriginal and Torres Strait Islander performance: A context and background to Aboriginal and Torres Strait Islander performance work around HIV,figshare,Dataset,10.26188/19395581,0,0,0,0,1,0,0,0,0,0,0,0,0,0,0,0,0,0,0,https://www.altmetric.com/details/130769410,https://api.altmetric.com/v1/donut/130769410_240.png
1,Open Research Case Study: Creating new data with parkrun,The University of Sheffield,Dataset,10.15131/shef.data.16628989,0,0,0,0,1,0,0,0,0,0,0,0,0,0,0,0,0,0,0,https://www.altmetric.com/details/115248589,https://api.altmetric.com/v1/donut/115248589_240.png
1,Sheffield Health and Wellbeing Board and Public Engagement,The University of Sheffield,Dataset,10.15131/shef.data.14900208,0,0,0,0,1,0,0,0,0,0,0,0,0,0,0,0,0,0,0,https://www.altmetric.com/details/108871156,https://api.altmetric.com/v1/donut/108871156_240.png
1,Evaluation of the British Red Cross Community Connectors Programme: final report,The University of Sheffield,Dataset,10.15131/shef.data.14560761,0,0,0,0,1,0,0,0,0,0,0,0,0,0,0,0,0,0,0,https://www.altmetric.com/details/105857408,https://api.altmetric.com/v1/donut/105857408_240.png
1,Scoping review of equity in the health needs and service coverage of older people,The University of Sheffield,Dataset,10.15131/shef.data.12326300,0,0,0,0,1,0,0,0,0,0,0,0,0,0,0,0,0,0,0,https://www.altmetric.com/details/82321840,https://api.altmetric.com/v1/donut/82321840_240.png
1,La Trobe University's Olga Tennison Autism Research Centre (OTARC) response to the Education and Employment Legislation Committee: Comment on the Higher Education Support Amendment (Job-Ready Graduates and Supporting Regional and Remote Students) Bill 2020's potential impact on autistic higher education students.,La Trobe,Dataset,10.26181/5f585f483a2e2,0,0,0,0,1,0,0,0,0,0,0,0,0,0,0,0,0,0,0,https://www.altmetric.com/details/115381971,https://api.altmetric.com/v1/donut/115381971_240.png
0,Executive functions: A crucial but overlooked factor for lifelong wellbeing,figshare,Dataset,10.17608/k6.auckland.16946011,0,0,0,0,0,0,0,0,0,0,0,0,0,0,0,0,0,0,0,https://www.altmetric.com/details/127789046,https://api.altmetric.com/v1/donut/127789046_240.png
0,COVID-19: impacts for LGBTIQ communities and implications for services: A Research Briefing Paper by Rainbow Health Victoria,La Trobe,Dataset,10.26181/5f0422ba95bd9,0,0,0,0,0,0,0,0,0,0,0,0,0,0,0,0,0,0,0,https://www.altmetric.com/details/117706286,https://api.altmetric.com/v1/donut/117706286_240.png
0,La Trobe University Olga Tennison Autism Research Centre (OTARC) response to the Select Committee on Autism,La Trobe,Dataset,10.26181/5f20f14745abe,0,0,0,0,0,0,0,0,0,0,0,0,0,0,0,0,0,0,0,https://www.altmetric.com/details/116950123,https://api.altmetric.com/v1/donut/116950123_240.png
0,Improving mask use to reduce Covid-19 transmission,figshare,Dataset,10.17608/k6.auckland.16632754,0,0,0,0,0,0,0,0,0,0,0,0,0,0,0,0,0,0,0,https://www.altmetric.com/details/114028229,https://api.altmetric.com/v1/donut/114028229_240.png
0,"The ethics of recruiting, retaining and tracing research participants online. Research Summary",La Trobe,Dataset,10.26181/5b97376578a11,0,0,0,0,0,0,0,0,0,0,0,0,0,0,0,0,0,0,0,https://www.altmetric.com/details/112948537,https://api.altmetric.com/v1/donut/112948537_240.png
0,Writing Themselves In 4: The health and wellbeing of LGBTQA+ young people in Australia. Australian Capital Territory summary report,La Trobe,Dataset,10.26181/601100156e419,0,0,0,0,0,0,0,0,0,0,0,0,0,0,0,0,0,0,0,https://www.altmetric.com/details/112550709,https://api.altmetric.com/v1/donut/112550709_240.png
0,Writing Themselves In 4: The health and wellbeing of LGBTQA+ young people in Australia. Victoria summary report.,La Trobe,Dataset,10.26181/60077a9e4653b,0,0,0,0,0,0,0,0,0,0,0,0,0,0,0,0,0,0,0,https://www.altmetric.com/details/112550693,https://api.altmetric.com/v1/donut/112550693_240.png
0,Writing Themselves In 4: the health and wellbeing of LGBTQA+ young people in Australia. South Australia summary report.,La Trobe,Dataset,10.26181/60112d78eeffe,0,0,0,0,0,0,0,0,0,0,0,0,0,0,0,0,0,0,0,https://www.altmetric.com/details/112550685,https://api.altmetric.com/v1/donut/112550685_240.png
0,Writing Themselves In 4: The health and wellbeing of LGBTQA+ young people in Australia. New South Wales summary report.,La Trobe,Dataset,10.26181/6011294b406d9,0,0,0,0,0,0,0,0,0,0,0,0,0,0,0,0,0,0,0,https://www.altmetric.com/details/112550678,https://api.altmetric.com/v1/donut/112550678_240.png
0,Writing Themselves In 4: The health and wellbeing of LGBTQA+ young people in Australia. National report.,La Trobe,Dataset,10.26181/6010fad9b244b,0,0,0,0,0,0,0,0,0,0,0,0,0,0,0,0,0,0,0,https://www.altmetric.com/details/112550672,https://api.altmetric.com/v1/donut/112550672_240.png
0,Spelares upplevelser av forandringar i vanor och problem. En kvalitativ studie om spel om pengar,figshare,Dataset,10.17045/sthlmuni.14769897,0,0,0,0,0,0,0,0,0,0,0,0,0,0,0,0,0,0,0,https://www.altmetric.com/details/112179731,https://api.altmetric.com/v1/donut/112179731_240.png
0,Intergenerational disadvantage: Why maternal mental health matters,figshare,Dataset,10.17608/k6.auckland.14616969,0,0,0,0,0,0,0,0,0,0,0,0,0,0,0,0,0,0,0,https://www.altmetric.com/details/111277982,https://api.altmetric.com/v1/donut/111277982_240.png
0,Living Diabetes Guidelines Consumer/Researcher Forums 2020,,Article,10.26181/603c274e3663f,0,0,0,0,0,0,0,0,0,0,0,0,0,0,0,0,0,0,0,https://www.altmetric.com/details/105828027,https://api.altmetric.com/v1/donut/105828027_240.png
0,"Models of Integrated Care, Health and Housing: Report prepared for the Royal Commission into Aged Care Quality and Safety",,Article,10.26181/5ff67526a028e,0,0,0,0,0,0,0,0,0,0,0,0,0,0,0,0,0,0,0,https://www.altmetric.com/details/100834082,https://api.altmetric.com/v1/donut/100834082_240.png
0,RAAF Pastoral Care and Hospitable Spaces: Designs that  nourish restoration and rehabilitation,,Article,10.26181/5fb1a2892b629,0,0,0,0,0,0,0,0,0,0,0,0,0,0,0,0,0,0,0,https://www.altmetric.com/details/97876153,https://api.altmetric.com/v1/donut/97876153_240.png
0,ADF - RAAF Chaplaincy Infrastructure: Pastoral Care Rehabilitation and Safe Spaces,,Article,10.26181/5fc074dd35b8e,0,0,0,0,0,0,0,0,0,0,0,0,0,0,0,0,0,0,0,https://www.altmetric.com/details/95566937,https://api.altmetric.com/v1/donut/95566937_240.png
0,Military Personnel and COVID-19: An Exploratory Scoping Review,,Article,10.26181/5fbc73d41425c,0,0,0,0,0,0,0,0,0,0,0,0,0,0,0,0,0,0,0,https://www.altmetric.com/details/95558898,https://api.altmetric.com/v1/donut/95558898_240.png
0,Smoking Interventions for People Who Use Illicit Drugs: A Systematic Scoping Review,,Article,10.26181/5fc858d502df7,0,0,0,0,0,0,0,0,0,0,0,0,0,0,0,0,0,0,0,https://www.altmetric.com/details/95535057,https://api.altmetric.com/v1/donut/95535057_240.png
0,Effectiveness of the Housing First model among substance users: A scoping review,,Article,10.26181/5fc071f59d92a,0,0,0,0,0,0,0,0,0,0,0,0,0,0,0,0,0,0,0,https://www.altmetric.com/details/95525350,https://api.altmetric.com/v1/donut/95525350_240.png
0,RAAF Chaplaincy Pastoral Care Rehabilitation and Providing Sacred Spaces: A Scoping Review,,Article,10.26181/5fb336b6a9fec,0,0,0,0,0,0,0,0,0,0,0,0,0,0,0,0,0,0,0,https://www.altmetric.com/details/95130139,https://api.altmetric.com/v1/donut/95130139_240.png
0,Pharmacy and Holistic Care:  An exploratory scoping review,figshare,Dataset,10.26181/5c12ea151c192,0,0,0,0,0,0,0,0,0,0,0,0,0,0,0,0,0,0,0,https://www.altmetric.com/details/52677133,https://api.altmetric.com/v1/donut/52677133_240.png
